Agency Name,URL,Summary,Acronym,Alias
Public Employee Relations Board,https://laborboard.maryland.gov/,"The Maryland Public Employee Relations Board (PERB) is a state agency established on July 1, 2023, to centralize and standardize the administration of collective bargaining for public sector employees. Formed by the consolidation of three previous labor boards, PERB is responsible for overseeing union representation elections, certifying exclusive representatives, and investigating and adjudicating unfair labor practice charges. The board's jurisdiction extends to state executive branch employees, higher education faculty and staff, community college employees, local public school system personnel, and independent home care providers, ensuring consistent enforcement of labor laws and resolution of disputes across Maryland's public workforce.",PERB,State Labor Relations Board; State Higher Education Labor Relations Board; Public School Labor Relations Board; Public Employees Relations Board
Public School Labor Relations Board,https://laborboards.maryland.gov/566-2/,"The Public School Labor Relations Board (PSLRB) was a Maryland state agency responsible for administering and enforcing labor relations laws pertaining to public elementary and secondary education. Established in 2010, the board adjudicated controversies and disputes between local boards of education and employee organizations, conducted elections for exclusive representatives, and resolved unit clarification issues. Effective July 1, 2023, the agency was abolished and its duties were consolidated into the Maryland Public Employee Relations Board (PERB), which now oversees labor relations for state, higher education, and public school employees.",PSLRB,Maryland Public School Labor Relations Board; Public Schools Labor Relations Board
Public Service Commission,https://www.psc.state.md.us/,"The Maryland Public Service Commission (PSC) is an independent administrative agency established in 1910 to regulate public utilities and passenger transportation services within the state. Its primary responsibility is to ensure that Maryland residents receive safe, reliable, and economical utility services by setting rates and overseeing the operations of companies providing electricity, natural gas, local telephone, for-profit water, and sewage disposal. The Commission also licenses retail energy suppliers, approves the construction of power plants and high-voltage transmission lines, and regulates common carriers including taxicabs in specific jurisdictions, passenger motor vehicle carriers, and railroads.",PSC,Maryland PSC; MPSC; Public Service Commission of Maryland; The Commission
Register of Wills,https://registers.maryland.gov/,"The Maryland Register of Wills is a constitutional state agency that operates offices in each county and Baltimore City. It is primarily responsible for the administrative probate of estates, which includes appointing personal representatives, overseeing the timely administration of decedents' estates, and maintaining permanent records of all probate proceedings. Additionally, the agency serves as the Clerk to the Orphans' Court, collects inheritance taxes and probate fees, and provides a secure service for the safekeeping of wills for living individuals.",ROW,Office of the Register of Wills; Clerk of the Orphans' Court; Prerogative Court of Maryland
Rural Maryland Council,https://rural.maryland.gov/,"The Rural Maryland Council (RMC) is an independent state agency, administratively housed within the Maryland Department of Agriculture, that serves as a partnership between federal, state, and local governments and the private sector. The agency's primary responsibility is to address the unique challenges facing Maryland's 18 rural counties by fostering regional cooperation, advocating for rural interests, and administering grant programs such as the Rural Maryland Prosperity Investment Fund (RMPIF). Its work focuses on improving the quality of life for residents by supporting agriculture, natural resource stewardship, economic development, and healthcare access in rural communities.",RMC,Forvm for Rural Maryland; The Forvm
Saint Mary's College of Maryland,https://www.smcm.edu/,"St. Mary's College of Maryland is a public liberal arts college and Maryland's designated public honors college. As an independent unit of the state government, it provides a high-quality, residential undergraduate education in the liberal arts and sciences, modeled after elite private colleges but accessible to Maryland residents. The college is responsible for fostering intellectual growth through diverse academic programs, including over 20 majors, a Master of Arts in Teaching, and specialized research at its waterfront campus, which shares its grounds with the Historic St. Mary's City archaeological site.",SMCM,St. Mary's Female Seminary; St. Mary's Female Seminary Junior College; St. Mary's Seminary Junior College; St. Mary's Seminary; St. Mary's College of Maryland
"Smart, Green & Growing",https://www.green.maryland.gov/,"Smart, Green & Growing is a multi-agency Maryland state initiative launched in 2008 to promote sustainable development, environmental protection, and economic growth. It coordinates efforts across various state departments—including the Maryland Department of Planning (MDP) and the Maryland Department of the Environment (MDE)—to protect the Chesapeake Bay, preserve farmland, revitalize communities, and reduce the state's carbon footprint. The initiative is grounded in 12 state planning visions that guide local and state-level decision-making regarding land use, transportation, and resource conservation.",SG&G,"Smart, Green and Growing initiative; Smart, Green and Growing legislation; PlanMaryland; Smart Growth initiative; Maryland: Smart, Green & Growing"
State Ethics Commission,https://ethics.maryland.gov/,"The Maryland State Ethics Commission (MSEC) is an independent agency responsible for the administration and enforcement of the Maryland Public Ethics Law. Its primary mission is to maintain public confidence in the integrity of State government by ensuring the impartiality and independent judgment of State officials and employees. The Commission's core responsibilities include managing financial disclosure programs for public officials, regulating lobbyist registration and reporting, providing mandatory ethics training, and issuing formal advisory opinions. Additionally, it investigates alleged ethics violations, handles complaints, and oversees the approval of local government and school board ethics laws to ensure they meet minimum State standards.",MSEC,Maryland Public Disclosure Advisory Board; State Board of Ethics
State Higher Education Labor Relations Board,https://laborboards.maryland.gov/higher-education-board/,"The State Higher Education Labor Relations Board (SHELRB) was an independent Maryland state agency responsible for overseeing collective bargaining for employees of the state's public institutions of higher education, including the University System of Maryland, Morgan State University, St. Mary's College of Maryland, and Baltimore City Community College. Its primary duties included supervising elections for exclusive representatives, investigating unfair labor practice charges, and resolving disputes related to labor-management relations. In July 2023, the board was abolished and its functions were consolidated into the newly created Public Employee Relations Board (PERB).",SHELRB,Maryland State Higher Education Labor Relations Board; Higher Education Labor Relations Board
State Highway Administration,https://www.sha.maryland.gov/,"The Maryland State Highway Administration (MDOT SHA) is a modal agency of the Maryland Department of Transportation responsible for planning, designing, constructing, and maintaining the state's non-toll, numbered highways and bridges outside of Baltimore City. The agency manages approximately 18,000 lane miles of roadway and more than 2,500 bridges, supporting the majority of vehicle travel in the state. Its primary responsibilities include snow and ice removal, traffic signal management, highway safety improvements, and administering the statewide ""Adopt-a-Highway"" program.",MDOT SHA,State Roads Commission; SRC; SHA; MDSHA; MSHA
State House Trust,https://msa.maryland.gov/msa/mdmanual/25ind/html/68shous.html,"The State House Trust is a Maryland state agency established in 1969 to oversee and manage the Maryland State House and the surrounding grounds within State Circle in Annapolis, including Lawyer's Mall. The Trust is responsible for supervising all repairs, landscaping, alterations, and improvements to the historic site, as well as regulating the use of the building's public areas and providing oversight for any exhibits or displays. It consists of four ex officio members—the Governor, the President of the Senate, the Speaker of the House of Delegates, and the Chairman of the Maryland Historical Trust—who serve as trustees to ensure the preservation and historical integrity of the oldest U.S. state capitol in continuous legislative use.",,Maryland State House Trust
State Workers' Compensation Commission,https://www.wcc.state.md.us/,"The Maryland State Workers' Compensation Commission is an independent agency that administers the state's Workers' Compensation Law and adjudicates claims for compensation arising from workplace injuries. The Commission's primary responsibilities include receiving and processing accident reports, conducting hearings for contested cases throughout the state, and referring injured workers to appropriate rehabilitation services. It also monitors insurance coverage, assesses penalties for non-compliance, and approves and oversees self-insured employers to ensure their financial solvency and adherence to state regulations.",WCC,State Industrial Accident Commission; Workmen's Compensation Commission; Workers' Compensation Commission; Employer and Employee Cooperative Fund
Subsequent Injury Fund,https://mdsif.state.md.us/,"The Subsequent Injury Fund (SIF) is an independent Maryland state agency that reviews and investigates workers' compensation claims involving pre-existing health conditions that substantially increase an injured worker's disability. Its primary mission is to encourage the employment of individuals with disabilities by limiting the financial liability of employers and insurers to the damages caused solely by a current workplace injury. The SIF assumes responsibility for the additional liability resulting from the combined effects of all injuries and conditions, managing a fund financed through assessments on permanent disability and settlement awards paid by insurers.",SIF,Subsequent Injury Fund Board; Workmen's Compensation Fund Board; Second Injury Fund
University System of Maryland,https://www.usmd.edu/,"The University System of Maryland (USM) is the state's public higher education system, consisting of 12 institutions, three regional higher education centers, and a system office. Its primary responsibilities include providing accessible and affordable undergraduate and graduate education, conducting groundbreaking research, and promoting economic growth and workforce development. The system coordinates academic programs and manages resources across its network to improve the quality of life for Maryland residents through innovation, community service, and strategic partnerships with business and government.",USM,University of Maryland System; University of Maryland and Board of Trustees of State Universities and Colleges merger
Volunteer Maryland,https://volunteer.maryland.gov/,"Volunteer Maryland (VM) is an AmeriCorps program and a unit within the Maryland Governor's Office of Community Initiatives (GOCI) that serves as a capacity-building agency for the state. Founded in 1993, it mission is to bridge the gap between those in need and those who can help by developing high-quality volunteer programs. The agency recruits and trains AmeriCorps members to serve as Volunteer Maryland Coordinators (VMCs) who are placed at nonprofit organizations, schools, and government agencies to build sustainable volunteer management systems and mobilize local volunteers to address critical community needs in education, human services, and the environment.",VM,Volunteer Maryland!; AmeriCorps Volunteer Maryland; Volunteer Maryland Program; unit of the Governor's Office of Community Initiatives
Maryland State Innovation Team,https://innovation.maryland.gov/Pages/default.aspx,"The Maryland State Innovation Team is a solution incubator launched in 2024 through a partnership between the State of Maryland and Bloomberg Philanthropies. As the first state-level team of its kind, it is charged with identifying, testing, and piloting novel initiatives to address the Governor's top priorities, specifically reducing child poverty and enhancing economic mobility. The team utilizes multi-disciplinary expertise in data analysis, rapid prototyping, and project management to help state agencies develop and incubate evidence-based strategies to improve outcomes for Maryland families.",i-team,Innovation Team; Bloomberg Philanthropies-supported state Innovation Team; Bloomberg Philanthropies Innovation Team
