Agency Name,URL,Summary,Acronym,Alias
Maryland Health Care Commission,https://mhcc.maryland.gov/,"The Maryland Health Care Commission (MHCC) is an independent regulatory agency within the Maryland Department of Health. Its primary responsibilities include planning for the state's health system needs, promoting informed decision-making, increasing accountability, and improving access to health care. The commission works to provide timely and accurate information regarding the availability, cost, and quality of health services to policy makers, purchasers, providers, and the public.",MHCC,Maryland Health Resources Planning Commission; Maryland Health Care Access and Cost Commission
Maryland Health Insurance Plan,https://www.marylandhealthconnection.gov/,"The Maryland Health Insurance Plan (MHIP) served as the state's high-risk pool, created to provide health insurance coverage to Maryland residents who were unable to obtain private coverage due to pre-existing medical conditions. Established in 2002 and reorganized as an independent agency in 2008, MHIP also administered the Senior Prescription Drug Assistance Program (SPDAP), which provides subsidies to eligible seniors for Medicare Part D costs. Following the implementation of the Affordable Care Act, most MHIP members transitioned to plans available through the Maryland Health Connection.",MHIP,MHIP; The Plan
Maryland Higher Education Commission,https://mhec.maryland.gov/,"The Maryland Higher Education Commission is the state's central regulatory and coordinating board responsible for overseeing postsecondary education. The agency establishes statewide policies for public and private colleges, universities, and for-profit career schools, ensuring they meet academic and financial standards. Additionally, it administers more than $100 million in financial aid programs annually to assist Maryland residents in achieving their higher education goals.",MHEC,Advisory Council on Higher Education; Maryland Council on Higher Education; State Board for Higher Education
Maryland Institute for Emergency Medical Services Systems,https://www.miemss.org/,"The Maryland Institute for Emergency Medical Services Systems (MIEMSS) is an independent state agency responsible for overseeing, coordinating, and regulating Maryland's statewide emergency medical services (EMS) network. The agency manages the planning, operation, and evaluation of the EMS system, which includes designating trauma and specialty referral centers, licensing commercial ambulance services, and maintaining the statewide emergency communications infrastructure to ensure effective prehospital care for residents.",MIEMSS,Maryland Institute for Emergency Medical Services; Maryland Institute for Emergency Medicine; MIEMS; MIEM
Maryland Insurance Administration,https://insurance.maryland.gov/,"The Maryland Insurance Administration (MIA) is an independent state agency tasked with regulating Maryland's insurance market to ensure fair practices, financial stability, and consumer protection. Its primary responsibilities include licensing insurance companies and producers, monitoring the financial solvency of insurers, reviewing and approving insurance rates and policy forms, investigating consumer complaints regarding claims or unfair practices, and enforcing compliance with state insurance laws.",MIA,Maryland Insurance Division; State Insurance Department; Insurance Department
Maryland Longitudinal Data System,https://mldscenter.maryland.gov/,"The Maryland Longitudinal Data System Center (MLDSC) serves as the State's central repository for linking and analyzing student and workforce data. The agency collects individual-level data from partner agencies—including the Maryland State Department of Education, Maryland Higher Education Commission, and Maryland Department of Labor—to generate timely information on student performance and workforce outcomes, which informs policy decisions and improves the State's education system.",MLDSC,MLDS Center; Maryland Longitudinal Data System
Maryland National Guard,https://military.maryland.gov/ng/,"The Maryland National Guard (MDNG) is a dual-mission military force comprised of the Maryland Army National Guard and the Maryland Air National Guard, operating under the Maryland Military Department. At the state level, it responds to domestic emergencies, natural disasters, and public safety needs under the command of the Governor of Maryland. At the federal level, it provides trained personnel and equipment for combat, peacekeeping, and humanitarian missions globally when activated by the President of the United States.",MDNG,Maryland Guard; Maryland Militia; The Maryland Line; Maryland Army National Guard; Maryland Air National Guard
Maryland Office of the Public Defender,https://www.opd.state.md.us/,"The Maryland Office of the Public Defender (OPD) is an independent state agency responsible for providing legal representation to indigent defendants—individuals who cannot afford private counsel—throughout the state. The agency safeguards fundamental individual rights by ensuring access to constitutional protections in criminal, juvenile, parental defense, and involuntary commitment proceedings where incarceration or detention is a possible penalty.",OPD,Maryland Public Defender; Office of the Public Defender; MD Public Defender
Maryland Office of Tourism Development,https://www.visitmaryland.org/,"The Maryland Office of Tourism Development (OTD) serves as the official state agency responsible for stimulating and driving Maryland's tourism economy. Operating within the Division of Tourism, Film and the Arts under the Maryland Department of Commerce, the agency promotes the state as a premier travel destination to domestic and international markets, develops recreational and cultural attractions, and manages the ""Visit Maryland"" brand and state welcome centers.",OTD,Maryland Office of Tourism; Tourism Development Office; Visit Maryland
Maryland Port Administration,https://mpa.maryland.gov/,"The Maryland Port Administration (MPA) is a modal administration within the Maryland Department of Transportation (MDOT) responsible for fostering and promoting waterborne commerce in the state. Its primary duties include the management, operation, and marketing of state-owned port facilities, most notably the Helen Delich Bentley Port of Baltimore. The agency oversees maritime business development, maintains shipping channels through dredging operations, and manages key terminals such as the Seagirt and Dundalk Marine Terminals to ensure the economic competitiveness of Maryland's maritime industry.",MPA,Maryland Port Authority; MDOT MPA; Port Administration
Maryland Public Broadcasting Commission,https://www.mpt.org/,"The Maryland Public Broadcasting Commission (MPBC) is the state agency responsible for establishing, operating, and maintaining a statewide system of educational and cultural television programming known as Maryland Public Television (MPT). The Commission holds the federal licenses for MPT's broadcast stations and oversees the creation, acquisition, and delivery of content for the general public and for use in Maryland's public schools.",MPBC,Maryland Public Television; MPT; Maryland Educational-Cultural Television Commission; Maryland Educational-Cultural Broadcasting Commission; Maryland Center for Public Broadcasting
Maryland School for the Deaf,https://www.msd.edu/,"The Maryland School for the Deaf (MSD) is a state agency dedicated to providing tuition-free public education and comprehensive support services to deaf and hard-of-hearing students residing in Maryland, from birth through age 21. With campuses in Frederick and Columbia, the agency utilizes a bilingual educational philosophy that fosters fluency in both American Sign Language (ASL) and English. The school focuses on academic achievement, early intervention, and social-emotional development to prepare students for college, career, and independent living.",MSD,Asylum for the Deaf and Dumb Mutes of the State of Maryland; Maryland Institution for the Deaf and Dumb; Maryland School for the Deaf and Dumb; Maryland State School for the Deaf
Maryland Stadium Authority,https://www.mdstad.com/,"The Maryland Stadium Authority (MSA) is a state agency established in 1986 to plan, finance, build, and manage sports and entertainment facilities in Maryland, most notably the Camden Yards Sports Complex, which includes Oriole Park and M&T Bank Stadium. Beyond professional sports venues, the agency’s responsibilities have expanded to include the design and construction of public schools through the 21st Century School Buildings Program and the Built to Learn Act, as well as the management of convention centers and economic development initiatives like the removal of blight in Baltimore City.",MSA,
Maryland State Archives,https://www.msa.maryland.gov/,"The Maryland State Archives is the central depository for government records of permanent value in Maryland, dating from the state's founding in 1634 to the present. The agency identifies, appraises, acquires, preserves, and makes accessible executive, legislative, and judicial records from state, county, and municipal governments, as well as special collections involving private papers, maps, and photographs. Additionally, the Archives oversees the Commission on Artistic Property and maintains the Maryland Manual On-Line.",MSA,Hall of Records; Maryland Hall of Records; State Archives
Maryland State Board of Contract Appeals,https://msbca.maryland.gov/,"The Maryland State Board of Contract Appeals (MSBCA) is an independent unit of the Executive Branch responsible for adjudicating bid protests and contract disputes between the State government and contractors or vendors. Its primary duties include resolving legal and factual disagreements regarding bid specifications, the qualification and selection of bidders, the bidding process, contract performance, compensation, claims, and termination.",MSBCA,Department of Transportation Board of Contract Appeals; MDOT Board of Contract Appeals
Maryland State Board of Elections,https://elections.maryland.gov/,"The Maryland State Board of Elections (SBE) is the official state agency responsible for supervising and administering elections in Maryland. It ensures compliance with state and federal election laws, oversees the activities of local boards of elections in each county and Baltimore City, manages the statewide voter registration system, certifies voting systems, and regulates campaign finance reporting to promote free, fair, and transparent elections.",SBE,State Administrative Board of Election Laws; SABEL
Maryland State Library,https://msla.maryland.gov/,"The Maryland State Library Agency (MSLA) is the official state agency responsible for providing strategic leadership, funding, and coordination for Maryland's 24 public library systems and the State Library Network. Established as an independent agency in 2017, it administers state and federal grants, facilitates resource sharing and interlibrary loans, and offers professional development for library staff. The agency also directly oversees specialized statewide programs, including the Maryland State Library for the Blind and Print Disabled (LBPD) and the Deaf Culture Digital Library, to ensure equitable access to information for all residents.",MSLA,Division of Library Development and Services; DLDS; Maryland Division of Library Development and Services; Office of Public Libraries; Division of Library Extension; MSL
Maryland State Lottery & Gaming Control Agency,https://www.mdlottery.com/,"The Maryland State Lottery & Gaming Control Agency serves as the regulatory body for all commercial gaming and lottery operations within Maryland. Its primary responsibilities include operating the state lottery, regulating the state's six casinos, and overseeing sports wagering and daily fantasy sports competitions. The agency ensures integrity and compliance across these industries while generating significant revenue to support state funds for education, public health, and safety.",MLGCA,State Lottery Agency; Maryland State Lottery Agency; Maryland Lottery; Maryland Lottery and Gaming
Maryland State Retirement Agency,https://www.sra.state.md.us/,"The Maryland State Retirement Agency (SRA) is the administrative body responsible for the operation and management of the State Retirement and Pension System (SRPS) of Maryland. The agency administers retirement, disability, and death benefits for more than 420,000 members, including state employees, teachers, law enforcement officers, judges, and legislators. Its primary responsibilities include collecting employer and employee contributions, supervising the management of the system's multi-billion dollar investment portfolio, and providing counseling and support services to participants and retirees to ensure the effective delivery of benefits.",SRA,State Retirement Agency; Maryland State Retirement and Pension Systems; State Retirement and Pension System of Maryland; MSRPS; SRPS
Maryland Tax Court,https://taxcourt.maryland.gov/,"The Maryland Tax Court is an independent administrative agency of the Maryland state government that serves as the highest level of administrative review for tax-related disputes. It performs quasi-judicial functions, hearing appeals from the final decisions of state and local taxing authorities, such as the Comptroller of Maryland and Property Tax Assessment Appeals Boards. The Court is responsible for making factual determinations and adjudicating cases involving income tax, sales and use tax, and assessments of real and personal property.",MTC,State Tax Commission; State Tax Commissioner
Maryland Teachers & State Employees Supplemental Retirement Plans,https://msrp.maryland.gov/,"The Maryland Teachers & State Employees Supplemental Retirement Plans (MSRP) is an independent state agency responsible for administering and overseeing voluntary supplemental retirement savings programs for Maryland state employees, teachers, and elected officials. The agency manages defined contribution plans, including the 457(b) Deferred Compensation Plan, 401(k) Savings and Investment Plan, 403(b) Tax-Deferred Annuity Plan, and the 401(a) Match Plan, which allow public employees to save for retirement with tax advantages in addition to their standard state pension.",MSRP,Maryland State Employees Supplemental Retirement Plans; Maryland Deferred Compensation Plan
Maryland Technology Development Corporation,https://www.tedcomd.com/,"The Maryland Technology Development Corporation, commonly known as TEDCO, functions as an independent instrumentality of the state dedicated to fostering economic growth through the support of early-stage, technology-based businesses. It facilitates the commercialization of technology from Maryland's research universities and federal laboratories into the marketplace by providing funding, resources, and connections to entrepreneurs. The agency manages various grant and investment programs designed to support an inclusive innovation ecosystem and accelerate the growth of technology companies across all regions of Maryland.",TEDCO,"Maryland Science, Engineering, and Technology Development Corporation"
Maryland Transit Administration,https://mta.maryland.gov/,"The Maryland Transit Administration (MTA) is a division of the Maryland Department of Transportation (MDOT) that operates one of the largest multi-modal public transit systems in the United States. Its primary responsibilities include the operation of local and commuter bus networks, the Baltimore Light RailLink, the Metro SubwayLink, and the MARC Train commuter rail service. The agency also provides paratransit services for people with disabilities and directs funding and technical assistance to locally operated transit systems across Maryland’s 23 counties, Baltimore City, and other municipalities.",MTA,Maryland Mass Transit Administration; Baltimore Metropolitan Transit Authority; Mass Transit Administration; MDOT MTA; MDOT Maryland Transit Administration
Maryland Transportation Authority,https://mdta.maryland.gov/,"The Maryland Transportation Authority (MDTA) is an independent state agency responsible for financing, constructing, operating, and maintaining Maryland's eight toll facilities, which include four bridges, two tunnels, and two toll roads. Established in 1971, the MDTA operates as a self-sufficient enterprise funded entirely by toll revenues and investment income rather than state tax dollars. In addition to managing its own facilities, the agency provides financing for other revenue-producing transportation projects for the Maryland Department of Transportation and maintains its own nationally accredited police force to ensure safety on its roadways.",MDTA,State Roads Commission; MdTA
Maryland Venture Capital Trust,https://msa.maryland.gov/msa/mdmanual/25ind/defunct/html/76vent.html,"The Maryland Venture Capital Trust was a state-chartered entity established in 1990 to provide a vehicle for Maryland's public pension funds and the state government to invest in venture capital limited partnerships. Acting as a ""fund-of-funds,"" the Trust sought to stimulate the state's economy by ensuring that the majority of its capital was invested in early-stage Maryland businesses. It was governed by a seven-member Board of Trustees appointed by the Governor and was administratively supported by the Department of Business and Economic Development. The Trust concluded its investment activities and completed its liquidation phase in January 2013, and it is currently categorized as a defunct independent agency of the State of Maryland.",,the Trust
MarylandSaves,https://www.marylandsaves.com/,"MarylandSaves is a state-sponsored retirement and emergency savings program designed to provide Maryland workers with a simple, automated way to save for the future. Administered by the Maryland Small Business Retirement Savings Board, the program is specifically aimed at private-sector employees whose employers do not offer a workplace retirement plan. Participants are enrolled in a portable Roth IRA, known as a WorkLife Account, which features automatic payroll deductions and a unique emergency savings component. To encourage participation, the state offers eligible employers a waiver of their $300 annual business filing fee for registering and facilitating the program for their staff.",MSBRSP,Maryland Small Business Retirement Savings Program; Maryland Small Business Retirement Savings Board; Maryland Small Business Retirement Savings Trust; MSBRSB; WorkLife Account
Morgan State University,https://www.morgan.edu/,"Morgan State University (MSU) is a public, historically black research university located in Baltimore and designated as Maryland's Preeminent Public Urban Research University. As a state agency governed by its own Board of Regents, it operates independently of the University System of Maryland. The university provides a comprehensive range of more than 100 academic programs leading to baccalaureate, master's, and doctoral degrees, with a particular emphasis on addressing the needs and challenges of urban environments through intensive research, effective public service, and community engagement.",MSU,Centenary Biblical Institute; Morgan College; Morgan State College; Morgan State
Motor Vehicle Administration,https://mva.maryland.gov/,"The Maryland Motor Vehicle Administration (MVA), an agency within the Maryland Department of Transportation (MDOT), is responsible for providing essential driver and vehicle services to the state's residents. Its primary responsibilities include issuing driver's licenses and identification cards, managing vehicle titling and registration, and administering the Vehicle Emissions Inspection Program (VEIP). Additionally, the agency oversees highway safety initiatives through its Highway Safety Office, maintains driving records, and regulates vehicle dealers and other automotive-related businesses to ensure compliance with Maryland's transportation laws.",MVA,MDOT MVA; Department of Motor Vehicles; DMV; Commissioner of Motor Vehicles
Office of Administrative Hearings,https://oah.maryland.gov/,"The Maryland Office of Administrative Hearings (OAH) is an independent, central panel agency within the executive branch that provides an impartial hearing process for contested cases involving more than 30 state agencies. Established in 1990 to centralize the adjudication of administrative disputes, the OAH employs independent Administrative Law Judges (ALJs) who hear cases ranging from motor vehicle license suspensions and special education disputes to regulatory enforcement and handgun permit reviews. The agency ensures due process by separating the adjudicative function from the state agencies whose actions are being contested, providing a transparent and objective forum for Maryland residents and businesses.",OAH,Maryland Office of Administrative Hearings
Office of Controlled Substances Administration,https://health.maryland.gov/OCSA/,"The Office of Controlled Substances Administration (OCSA), a division of the Maryland Department of Health, is responsible for enforcing the state's Controlled Dangerous Substance (CDS) Act. The agency ensures that controlled medications are available only for legitimate medical and scientific purposes by issuing CDS permits to practitioners, researchers, and medical establishments. Its primary duties include inspecting over 40,000 registrants, regulating the prescribing and dispensing of drugs, and managing the state's supplemental CDS list to protect the health and safety of Maryland residents.",OCSA,Division of Drug Control; Maryland Office of Controlled Substances Administration
Office of Legislative Audits,https://www.ola.state.md.us/index.html,"The Office of Legislative Audits (OLA) is an independent, non-partisan agency within the Maryland General Assembly's Department of Legislative Services. It is responsible for conducting periodic fiscal compliance audits of all executive and judicial branch agencies, as well as performance audits and evaluations of state programs and local school systems. The office focuses on ensuring financial accountability, legal compliance, and the efficiency of state government operations. Additionally, the OLA operates a fraud, waste, and abuse hotline to investigate allegations involving state agencies and employees.",OLA,Legislative Auditor; Maryland Office of Legislative Audits; Department of Fiscal Services
Office of the People's Counsel,https://opc.maryland.gov/,"The Maryland Office of the People's Counsel (OPC) is an independent state agency that represents the interests of Maryland's residential utility consumers. Established in 1924 as the oldest utility consumer advocacy office in the United States, it advocates for safe, reliable, and reasonably priced electric, natural gas, telecommunications, private water, and regulated transportation services. The agency represents consumers in proceedings before the Maryland Public Service Commission, federal regulatory agencies, and the courts, focusing on issues such as utility rates, service quality, and environmental sustainability.",OPC,Maryland People's Counsel; Maryland Office of People's Counsel
Office of the State Prosecutor,https://osp.maryland.gov/,"The Office of the State Prosecutor (OSP) is an independent agency within the executive branch of Maryland's government that investigates and prosecutes criminal offenses related to the integrity of state officials, institutions, and the electoral process. Its primary responsibilities include enforcing state election and public ethics laws, as well as prosecuting bribery, misconduct in office, extortion, and perjury. The office may initiate investigations independently or act upon requests from high-level state officials and agencies such as the Governor, the Attorney General, or the General Assembly.",OSP,State Prosecutor's Office; Office of State Prosecutor; Maryland State Prosecutor
Pimlico Community Development Authority,https://msa.maryland.gov/msa/mdmanual/25ind/html/55pimlico.html,"The Pimlico Community Development Authority (PCDA) is a state-mandated advisory body established by the Maryland General Assembly in 2005 to oversee the allocation of Local Impact Aid, which consists of revenue from Video Lottery Terminals (slots) and Racetrack Impact Funds. The authority provides community input and makes recommendations to the Mayor of Baltimore regarding funding priorities for infrastructure, public safety, housing, and economic development projects in the neighborhoods surrounding the Pimlico Race Course. Its work primarily focuses on supporting the implementation of the Park Heights Master Plan and revitalizing communities within a one-mile radius of the racetrack.",PCDA,Local Development Council; Local Development Council for the Pimlico neighborhood; Local Video Lottery Development Council
Property Tax Assessment Appeals Board,https://ptaab.maryland.gov,"The Maryland Property Tax Assessment Appeals Board (PTAAB) is an independent agency that provides a second level of administrative review for property tax assessment disputes. It is composed of 24 local boards—one for each of Maryland's 23 counties and Baltimore City—whose members are local residents appointed by the Governor. The PTAAB hears appeals regarding the valuation of real and personal property, as well as disputes over tax exemptions and various property tax credits, following an initial decision by the local Supervisor of Assessments from the State Department of Assessments and Taxation (SDAT). Decisions made by the PTAAB can be further appealed to the Maryland Tax Court.",PTAAB,Property Tax Assessment Appeals Boards; Local Property Tax Assessment Appeal Boards
